"STUDY_ID","REVIEWERS","INCLUDE","journal","abstract","title","volume","pages","author"
"5","Aaron_2","NO","Viruses","African swine fever (ASF) is a high-consequence transboundary hemorrhagic fever of swine. It continues to spread across the globe causing socio-economic issues and threatening food security and biodiversity. In 2020, Nigeria reported a major ASF outbreak, killing close to half a million pigs. Based on the partial sequences of the genes B646L (p72) and E183L (p54), the virus responsible for the outbreak was identified as an African swine fever virus (ASFV) p72 genotype II. Here, we report further characterization of ASFV RV502, one of the isolates obtained during the outbreak. The whole genome sequence of this virus revealed a deletion of 6535 bp between the nucleotide positions 11,760-18,295 of the genome, and an apparent reverse complement duplication of the 5' end of the genome at the 3' end. Phylogenetically, ASFV RV502 clustered together with ASFV MAL/19/Karonga and ASFV Tanzania/Rukwa/2017/1 suggesting that the virus responsible for the 2020 outbreak in Nigeria has a South-eastern African origin.","Characterization of a Novel African Swine Fever Virus p72 Genotype II from Nigeria.","15",NA,"Ambagala A and Goonewardene K and Lamboo L and Goolia M and Erdelyan C and Fisher M and Handel K and Lung O and Blome S and King J and Forth JH and Calvelage S and Spinard E and Gladue DP and Masembe C and Adedeji AJ and Olubade T and Maurice NA and Ularamu HG and Luka PD"
"6","Aaron_2","NO","Frontiers in microbiology","Equine herpesvirus-1 (EHV-1) is one of the most important and prevalent viral pathogens of horses and a major threat to the equine industry throughout most of the world. EHV-1 primarily causes respiratory disease but viral spread to distant organs enables the development of more severe sequelae; abortion and neurologic disease. The virus can also undergo latency during which viral genes are minimally expressed, and reactivate to produce lytic infection at any time. Recently, there has been a trend of increasing numbers of outbreaks of a devastating form of EHV-1, equine herpesviral myeloencephalopathy. This review presents detailed information on EHV-1, from the discovery of the virus to latest developments on treatment and control of the diseases it causes. We also provide updates on recent EHV-1 research with particular emphasis on viral biology which enables pathogenesis in the natural host. The information presented herein will be useful in understanding EHV-1 and formulating policies that would help limit the spread of EHV-1 within horse populations.","EHV-1: A Constant Threat to the Horse Industry.","10","2668","Oladunni FS and Horohov DW and Chambers TM"
"30","Aaron_2","NO","International journal of health geographics","BACKGROUND: Since 2005, the Qinghai-like lineage of the highly pathogenic avian influenza A virus H5N1 has rapidly spread westward to Europe, the Middle East and Africa, reaching a dominant level at a global scale in 2006. METHODS: Based on a combination of genetic sequence data and H5N1 outbreak information from 2005 to 2011, we use an interdisciplinary approach to improve our understanding of the transmission pattern of this particular clade 2.2, and present cartography of global spatiotemporal transmission footprints with genetic characteristics. RESULTS: Four major viral transmission routes were derived with three sources- Russia, Mongolia, and the Middle East (Kuwait and Saudi Arabia)-in the three consecutive years 2005, 2006 and 2007. With spatiotemporal transmission along each route, genetic distances to isolate A/goose/Guangdong/1996 are becoming significantly larger, leading to a more challenging situation in certain regions like Korea, India, France, Germany, Nigeria and Sudan. Europe and India have had at least two incursions along multiple routes, causing a mixed virus situation. In addition, spatiotemporal distribution along the routes showed that 2007/2008 was a temporal separation point for the infection of different host species; specifically, wild birds were the main host in 2005-2007/2008 and poultry was responsible for the genetic mutation in 2009-2011. ""Global-to-local"" and ""high-to-low latitude"" transmission footprints have been observed. CONCLUSIONS: Our results suggest that both wild birds and poultry play important roles in the transmission of the H5N1 virus clade, but with different spatial, temporal, and genetic dominance. These characteristics necessitate that special attention be paid to countries along the transmission routes.","Global spatiotemporal and genetic footprint of the H5N1 avian influenza virus.","13","14","Li R and Jiang Z and Xu B"
"41","Aaron_2","NO","BMC research notes","OBJECTIVE: In the framework of EVALMOUS study aiming to assess the use and effectiveness of mosquito nets by pregnant women and other members of their household in a lagoon area in southern Benin, the behaviour of pregnant women relative to the time they go to bed using the net were recorded. Malaria vectors biting rhythm, Plasmodium falciparum infection and insecticide resistance genes in malaria vectors were also determined. RESULTS: Overall, 3848 females of Anopheles gambiae s. l were collected and 280 pregnant women responded to the survey. Almost all Anopheles gambiae s. l. tested were Anopheles coluzzi Coetzee and Wilkerson 2013 (Diptera: Culicidae). The CSP index in malaria vector was 1.85% and the allelic frequency of kdr gene was 74.4%. Around 90% of bites and Plasmodium falciparum Welch, 1897 (Haemosporida: Plasmodiidae) transmission occurred between 10 p.m. and 6 a.m., which coincides with the period when more than 80% of pregnant women were under bednet. Despite a slight early evening and early morning biting activity of malaria vectors in the study area, the good use of nets might remain a useful protection tool against mosquito biting and malaria transmission.","Human biting rhythm of Anopheles gambiae Giles, 1902 (Diptera: Culicidae) and sleeping behaviour of pregnant women in a lagoon area in Southern Benin.","14","200","Djènontin A and Bouraima A and Soares C and Egbinola S and Cottrell G"
"42","Aaron_2","NO","BMC microbiology","INTRODUCTION: Probiotic lactobacilli are generally recognized as safe (GRAS) and are being used in several food and pharma formulations. However, growing concern of antibiotic resistance in bacterial strains of food origin and its possible transmission via functional foods is increasingly being emphasized. OBJECTIVES: This study screened potential probiotic lactic acid bacteria (LAB) strains for their phenotypic and genotypic antibiotic resistance profiles. METHODS: Susceptibility to different antibiotics was assayed by the Kirby Bauer standard disc diffusion protocol. Both conventional and SYBR-RTq-PCR were used for detection of resistance coding genes. RESULTS: A variable susceptibility pattern was documented against different antibiotic classes. LAB strains irrespective of origin displayed marked phenotypic resistance against cephalosporins, aminoglycosides, quinolones, glycopeptides; and methicillin among beta-lactams with few exceptions. In contrast, high sensitivity was recorded against macrolides, sulphonamides and carbapenems sub-group of beta-lactams with some variations. parC, associated with ciprofloxacin resistance was detected in 76.5% of the strains. Other prevalent resistant determinants observed were aac(6?)Ii (42.1%), ermB, ermC (29.4%), and tetM (20.5%). Six (?17.6%) of the isolates were free from genetic resistance determinants screened in this study. CONCLUSION: Study revealed presence of antibiotic resistance determinants among lactobacilli from both fermented foods and human sources.","Antibiotic resistance in potential probiotic lactic acid bacteria of fermented foods and human origin from Nigeria.","23","142","Duche RT and Singh A and Wandhare AG and Sangwan V and Sihag MK and Nwagu TNT and Panwar H and Ezeogu LI"
"43","Aaron_2","NO","Virology journal","BACKGROUND: Coinfections of HIV-positive individuals with Hepatitis B and D virus (HBV and HDV) are common and can be associated with rapid liver damage. Several antiretroviral drugs for HIV exhibit anti-HBV effect; however, the selection of HBV drug resistance mutations (DRMs) in individuals under HIV antiretroviral therapy (ART) has been reported but rarely in Nigeria. In this study the HBV/HDV prevalence and HBV DRMs in HIV-positive individuals in Southwestern Nigeria were assessed. METHODS: Plasma samples collected from 310 HIV-positive individuals including 295 ART-experienced and 15 ART-naïve persons attending the HIV clinic in three south-western states of Nigeria between June 2017 and August 2017 were analysed by ELISA for HBsAg and anti-HDV. The presence of HDV RNA and HBV DNA was analysed by (RT)-PCR followed by sequencing and phylogenetic analyses for genotyping. The HBV reverse transcription (RT) region was amplified and sequenced for the analysis of drug resistance mutations. RESULTS: Overall, 16.1% (n = 50/310) of the HIV-positive individuals were positive for HBsAg, most of which were ART-experienced (94.0%; n = 47/50). From the 50 HBsAg-positive samples, 72.0% (n = 36/50) were positive for HBV DNA and 16.0% (n = 8/50) had detectable HDV RNA while 5.6% (n = 2/36) of the HBV-DNA positive samples had anti-HDV total antibodies. Sequences were available for 31/36 of the HBV DNA-positive and 3/8 HDV RNA-positive samples. HBV DNA-positive samples were characterised as HBV genotype E infections exclusively, while HDV genotype 1 was detected in the HDV RNA-positive samples. HBV DRMs V173L, L180M, S202I and M204V/I, which are associated with lamivudine resistance, were detected in 32.2% (n = 10/31) of the HBV DNA-positive samples. Most of these mutations (90.0%; n = 9/10) were present in the ART-experienced cohort. CONCLUSIONS: This study indicates that HBV/HDV coinfections are common in HIV-positive individuals under ART in Nigeria. Furthermore, a high proportion of HBV DRMs which potentially compromise future treatment options were detected, underscoring the need for HBV screening prior to starting ART. Further studies should be performed to monitor a possible increase in the spread of HDV among populations at risk of HIV and HBV infections.","Prevalence and characteristics of hepatitis B and D virus infections among HIV-positive individuals in Southwestern Nigeria.","18","20","Opaleye OO and Akanbi OA and Osundare FA and Wang B and Adesina O and Oluremi AS and Sunday ST and Akindele AA and Klink P and Bock CT"
"47","Aaron_2","NO","Pediatric research","Nigerian neonates have a high incidence of bilirubin encephalopathy. Glucose-6-phosphate dehydrogenase (G-6-PD) deficiency is prevalent in this population. (TA)7 promoter polymorphism in the gene encoding the bilirubin conjugating enzyme UDP-glucuronosyltransferase 1A1 (UGT1A1) potentiates hyperbilirubinemia in G-6-PD deficient neonates. We studied (TA)n allele frequency to determine, at least in part, its contribution to the frequency and severity of hyperbilirubinemia. DNA was extracted from umbilical cord blood of sequentially born Nigerian neonates and the (TA)n UGT1A1 promoter sequence determined. The (TA)n allele distribution was compared with reported adults of varying African ancestry and Sephardic Jewish neonates. Among 88 Nigerian neonates, (TA)6 and (TA)7 alleles were almost equally distributed (0.46 and 0.43, respectively). Some individuals with (TA)5 and (TA)8 sequences were encountered. Allele distribution was similar to that of the African ancestry population but differed from the Sephardic Jewish newborns, in whom the (TA)6/(TA)7 distribution was 0.65/0.35. Whereas 45% of Nigerian alleles and 50% of African ancestry alleles, respectively, included a (TA)7 or (TA)8 sequence, only 35% of Jewish alleles were (TA)7 (p < 0.001), and no (TA)8 alleles were encountered. The high frequency of (TA)n promoter polymorphism, coupled with G-6-PD deficiency, may contribute to the pathogenesis of extreme neonatal hyperbilirubinemia in Nigeria.","(TA)n UDP-glucuronosyltransferase 1A1 promoter polymorphism in Nigerian neonates.","63","109-11","Kaplan M and Slusher T and Renbaum P and Essiet DF and Pam S and Levy-Lahad E and Hammerman C"
"75","Aaron_2","NO","International journal of microbiology","The increase in the incidence of extended-spectrum β-lactamase- (ESBL-) producing Klebsiella species has become a serious problem worldwide, because of their incrimination in antibiotic resistance. The objective of this study is to investigate the resistance genes responsible for ESBL-producing Klebsiella species and carbapenemase-producing Klebsiella (CRE) isolated in Mthatha and to study their epidemiology. A prospective, descriptive study of 202 nonrepetitive samples from patients was obtained from Nelson Mandela Academic Hospital. The cultured Klebsiella isolates were subjected to antimicrobial susceptibility tests and the polymerase chain reaction of bla(CTX-M), bla(TEM), bla(SHV), bla(KPC), and bla(NDM) genes. Overall K. pneumoniae were the majority with 169 (83.7%) species isolates, followed by K. oxytoca with 29 (14.4%), while K. ozaenae and Raoultella ornithinolytica were 2 (0.9%) each. The prevalence of ESBL production in all Klebsiella species was 117 (57.9%). ESBL-genotypic resistance is driven in Mthatha by bla(SHV) 121 (77.1%) followed by bla(TEM) 105 (66.9%) and bla(CTX-M) at 89 (56.7%). The most common ESBL genotype combination among the Klebsiella was bla(TEM) + bla(SHV) + bla(CTX-M) at 79 (50.3%). There is a steady increase in the rate of ESBL genes in the last five years.","Molecular Characteristics and Antibiotic Resistance Profiles of Klebsiella Isolates in Mthatha, Eastern Cape Province, South Africa.","2017","8486742","Vasaikar S and Obi L and Morobe I and Bisi-Johnson M"
"78","Aaron_2","NO","Human molecular genetics","Orofacial clefts are common developmental disorders that pose significant clinical, economical and psychological problems. We conducted genome-wide association analyses for cleft palate only (CPO) and cleft lip with or without palate (CL/P) with ~17 million markers in sub-Saharan Africans. After replication and combined analyses, we identified novel loci for CPO at or near genome-wide significance on chromosomes 2 (near CTNNA2) and 19 (near SULT2A1). In situ hybridization of Sult2a1 in mice showed expression of SULT2A1 in mesenchymal cells in palate, palatal rugae and palatal epithelium in the fused palate. The previously reported 8q24 was the most significant locus for CL/P in our study, and we replicated several previously reported loci including PAX7 and VAX1.","Genomic analyses in African populations identify novel risk loci for cleft palate.","28","1038-1051","Butali A and Mossey PA and Adeyemo WL and Eshete MA and Gowans LJJ and Busch TD and Jain D and Yu W and Huan L and Laurie CA and Laurie CC and Nelson S and Li M and Sanchez-Lara PA and Magee WP and Magee KS and Auslander A and Brindopke F and Kay DM and Caggana M and Romitti PA and Mills JL and Audu R and Onwuamah C and Oseni GO and Owais A and James O and Olaitan PB and Aregbesola BS and Braimah RO and Oginni FO and Oladele AO and Bello SA and Rhodes J and Shiang R and Donkor P and Obiri-Yeboah S and Arthur FKN and Twumasi P and Agbenorku P and Plange-Rhule G and Oti AA and Ogunlewe OM and Oladega AA and Adekunle AA and Erinoso AO and Adamson OO and Elufowoju AA and Ayelomi OI and Hailu T and Hailu A and Demissie Y and Derebew M and Eliason S and Romero-Bustillous M and Lo C and Park J and Desai S and Mohammed M and Abate F and Abdur-Rahman LO and Anand D and Saadi I and Oladugba AV and Lachke SA and Amendt BA and Rotimi CN and Marazita ML and Cornell RA and Murray JC and Adeyemo AA"
"80","Aaron_2","NO","PloS one","Hepatitis B virus genotype E (HBV/E) is highly prevalent in Western Africa. In this work, 30 HBV/E isolates from HBsAg positive Angolans (staff and visitors of a private hospital in Luanda) were genetically characterized: 16 of them were completely sequenced and the pre-S/S sequences of the remaining 14 were determined. A high proportion (12/30, 40%) of subjects tested positive for both HBsAg and anti-HBs markers. Deduced amino acid sequences revealed the existence of specific substitutions and deletions in the B- and T-cell epitopes of the surface antigen (pre-S1- and pre-S2 regions) of the virus isolates derived from 8/12 individuals with concurrent HBsAg/anti-HBs. Phylogenetic analysis performed with 231 HBV/E full-length sequences, including 16 from this study, showed that all isolates from Angola, Namibia and the Democratic Republic of Congo (n = 28) clustered in a separate lineage, divergent from the HBV/E isolates from nine other African countries, namely Cameroon, Central African Republic, Côte d'Ivoire, Ghana, Guinea, Madagascar, Niger, Nigeria and Sudan, with a Bayesian posterior probability of 1. Five specific mutations, namely small S protein T57I, polymerase Q177H, G245W and M612L, and X protein V30L, were observed in 79-96% of the isolates of the separate lineage, compared to a frequency of 0-12% among the other HBV/E African isolates.","Analysis of complete nucleotide sequences of Angolan hepatitis B virus isolates reveals the existence of a separate lineage within genotype E.","9","e92223","Lago BV and Mello FC and Ribas FS and Valente F and Soares CC and Niel C and Gomes SA"
"105","Aaron_2","NO","Zoonoses and public health","Leptospirosis is a neglected zoonosis with a nearly global distribution. In order to determine the role of bats in the epidemiology of leptospirosis in Nigeria, a total of 231 bats belonging to three families, Pteropodidae (n = 117), Molossidae (n = 107) and Nycteridae (n = 17), roosting in human habitats were screened by PCR and sequencing for the detection of pathogenic Leptospira species. DNA extracted from the kidneys of bats were subjected to conventional PCR targeting the rrs1, rrs2, flaB and secY genes for the detection of pathogenic Leptospira spp. Overall, 27 out of the 231 (11.7%) of the samples screened were positive for Leptospira spp. High prevalence (>80%) of Leptospira spp. DNA was detected in Chaerophon and Nycteris bat species captures in an abandoned well located within a human habitation. Sequences generated in this study were highly identical to Leptospira borgpetersenii and Leptospira interrogans and clustered with sequences of pathogenic species in GenBank. The detection of pathogenic Leptospira spp. was significantly associated (p < .001) with the bat species, feeding habit, roosting site and study location. To the best of our knowledge, this is the first molecular detection and characterization of pathogenic Leptospira spp. in bats from Nigeria. Results show that bats in Nigeria are infected with diverse Leptospira genotypes phylogenetically related to known pathogenic, including zoonotic taxa. Together, these findings reinforce bats' roles as potential reservoirs of Leptospira spp. and should be considered as a starting point for future comparative studies to improve our understanding of the epidemiology of this bacterial pathogen in Nigeria.","Molecular detection and characterization of pathogenic Leptospira species in bats (Chiroptera) roosting in human habitats in Nigeria, West Africa.","68","908-916","Kamani J and Harrus S and Ocholi RA and Yague II and Nyango PG and González-Miguel J and Koizumi N"
"119","Aaron_2","NO","Viruses","Peste des Petits Ruminants (PPR) is a highly infectious disease caused by a virus of the Morbillivirus genus. The current PPR eradication effort relies mainly on the implementation of massive vaccination campaigns. One of the most widely used PPR vaccines is the Nigeria 75/1 strain obtained after attenuation by 75 serial passages of the wild type isolate in cell cultures. Here we use high throughput deep sequencing of the historical passages that led to the Nigeria 75/1 attenuated strain to understand the evolution of PPRV attenuation and to assess the risk of reversal in different cell types. Comparison of the consensus sequences of the wild type and vaccine strains showed that only 18 fixed mutations separate the two strains. At the earliest attenuation passage at our disposal (passage 47), 12 out of the 18 mutations were already present at a frequency of 100%. Low-frequency variants were identified along the genome in all passages. Sequencing of passages after the vaccine strain showed evidence of genetic drift during cell passages, especially in cells expressing the SLAM receptor targeted by PPRV. However, 15 out of the 18 mutations related to attenuation remained fixed in the population. In vitro experiments suggest that one mutation in the leader region of the PPRV genome affects virus replication. Our results suggest that only a few mutations can have a serious impact on the pathogenicity of PPRV. Risk of reversion to virulence of the attenuated PPRV strain Nigeria 75/1 during serial passages in cell cultures seems low but limiting the number of passages during vaccine production is recommended.","Evolution of Attenuation and Risk of Reversal in Peste des Petits Ruminants Vaccine Strain Nigeria 75/1.","11",NA,"Eloiflin RJ and Boyer M and Kwiatek O and Guendouz S and Loire E and Servan de Almeida R and Libeau G and Bataille A"
"134","Aaron_2","NO","Infection, genetics and evolution : journal of molecular epidemiology and and evolutionary genetics in infectious diseases","Giardia duodenalis is an intestinal flagellated protozoan parasite that is infectious to humans and a wide range of animals worldwide. While varying prevalence rates have been reported in pigs worldwide, there are currently no published reports on the genotypes of Giardia infecting pigs in any African country. The present study is on the prevalence and genotypes of G. duodenalis in 209 pigs raised on four farms in Ogun State Nigeria. Using an enzyme-linked immunosorbent assay (ELISA) kit, Giardia duodenalis coproantigens were detected on all farms and in 25.4% (53/209) of pigs sampled. However, there was no significant influence (p > 0.05) of age, sex and stool consistencies of the pigs on the distribution of the infection. Genotyping of Giardia duodenalis in all ELISA-positive samples, achieved by the amplification of the small subunit ribosomal RNA (ssu rRNA), glutamate dehydrogenase (gdh), triosephosphate isomerase (tpi) and beta giardin (bg) genes, identified 14 and 37 assemblage B and E isolates respectively while mixed infection by both assemblages was recorded in two isolates. Novel nucleotide substitutions were identified in four assemblage B isolates at the ssu rRNA locus. Genetic diversity was observed among the assemblage B isolates after multiple alignment analyses of the gdh, tpi and bg sequences whereby sub-assemblages BII (n = 2), BIII (n = 9) and BIV (n = 3) were identified. The assemblage B isolates from pigs in this study were phylogenetically related to isolates from humans, marmoset and cattle while the assemblage E isolates were related to isolates from sheep, goats and cattle. These findings suggest that pigs in southwest Nigeria predominantly harbour G. duodenalis isolates that could be infectious to other animal species and to a lesser extent, isolates that may be of zoonotic importance.","Prevalence and multilocus genotypes of Giardia duodenalis infecting pigs in Ogun state, Nigeria.","70","53-60","Akinkuotu OA and Takeet MI and Otesile EB and Olufemi F and Greenwood SJ and McClure JT"
