"STUDY_ID","REVIEWERS","INCLUDE","journal","abstract","title","volume","pages","author"
"139","Aaron_2","NO","Microbiology spectrum","Insecticide resistance among mosquito species is now a pervasive phenomenon that threatens to jeopardize global malaria vector control efforts. Evidence of links between the mosquito microbiota and insecticide resistance is emerging, with significant enrichment of insecticide degrading bacteria and enzymes in resistant populations. Using 16S rRNA amplicon sequencing, we characterized and compared the microbiota of Anopheles coluzzii in relation to their deltamethrin resistance and exposure profiles. Comparisons between 2- and 3-day-old deltamethrin-resistant and -susceptible mosquitoes demonstrated significant differences in microbiota diversity. Ochrobactrum, Lysinibacillus, and Stenotrophomonas genera, each of which comprised insecticide-degrading species, were significantly enriched in resistant mosquitoes. Susceptible mosquitoes had a significant reduction in alpha diversity compared to resistant individuals, with Asaia and Serratia dominating microbial profiles. There was no significant difference in deltamethrin-exposed and -unexposed 5- to 6-day-old individuals, suggesting that insecticide exposure had minimal impact on microbial composition. Serratia and Asaia were also dominant in 5- to 6-day-old mosquitoes, which had reduced microbial diversity compared to 2- to 3-day-old mosquitoes. Our findings revealed significant alterations of Anopheles coluzzii microbiota associated with deltamethrin resistance, highlighting the potential for identification of novel microbial markers for insecticide resistance surveillance. qPCR detection of Serratia and Asaia was consistent with 16S rRNA sequencing, suggesting that population-level field screening of bacterial microbiota may be feasibly integrated into wider resistance monitoring, if reliable and reproducible markers associated with phenotype can be identified. IMPORTANCE Control of insecticide-resistant vector populations remains a significant challenge to global malaria control and while substantial progress has been made elucidating key target site mutations, overexpressed detoxification enzymes and alternate gene families, the contribution of the mosquito microbiota to phenotypic insecticide resistance has been largely overlooked. We focused on determining the effects of deltamethrin resistance intensity on Anopheles coluzzii microbiota and identifying any microbial taxa associated with phenotype. We demonstrated a significant reduction in microbial diversity between deltamethrin-resistant and -susceptible mosquitoes. Insecticide degrading bacterial species belonging to Ochrobactrum, Lysinibacillus, and Stenotrophomonas genera were significantly enriched in resistant mosquitoes, while Asaia and Serratia dominated microbial profiles of susceptible individuals. Our results revealed significant alterations of Anopheles coluzzii microbiota associated with deltamethrin resistance, highlighting the potential for identification of novel microbial markers for surveillance and opportunities for designing innovative control techniques to prevent the further evolution and spread of insecticide resistance.","Overabundance of Asaia and Serratia Bacteria Is Associated with Deltamethrin Insecticide Susceptibility in Anopheles coluzzii from Agboville, Côte d'Ivoire.","9","e0015721","Pelloquin B and Kristan M and Edi C and Meiwald A and Clark E and Jeffries CL and Walker T and Dada N and Messenger LA"
"146","Aaron_2","NO","Heliyon","OBJECTIVE: Prospective cross-sectional study of dogs in Nigeria to study leptospirosis, inferred to be endemic in all regions of the country by researchers. Aim is to generate empirical updated evidence of leptospiral infection and delineate serovars involved. METHODS: Study determined the sero-prevalence and infection rate in 342 dogs using sero-assays, culture isolation and novel qPCR. In-house designed primers targeting conserved regions were used to amplify genes in quantitative Real-Time PCR (qRT-PCR) for leptospiral detection to serogroups. Molecular analysis of the leptospiral 16S rRNA and LipL32 genes were used for identification of pathogenic Leptospira species. Primers targeting the O-antigen (rfb) region of the Leptospira lipopolysaccharide (LPS) were used for differentiating serovars based on comparative melting temperature (T(m)) analysis against reference serogroups. RESULTS: Overall serological and bacteriological prevalence of 56 (16.4%) and 40 (11.7%) respectively was recorded. Vaccination, ages and season(s) were the strongest determinants of infection. Unvaccinated animals, stray dogs and symptomatic dogs presented statistically significant (P < 0.05) higher risk of infection: OR 25.531 (6.108, 106.712; 95% CI). DISCUSSION: The evidence suggests 1 of every 10 dogs is infected and could be symptomatic for the disease or a carrier of leptospires in the studied region in Nigeria with attendant public health risks.","Serological and molecular epidemiology of leptospirosis and the role of dogs as sentinel for human infection in Nigeria.","8","e09484","Pilau NN and Lubar AA and Daneji AI and Mera UM and Magaji AA and Abiayi EA and Chaiboonma KL and Busayo EI and Vinetz JM and Matthias MA"
"166","Aaron_2","YES","Malaria journal","BACKGROUND: Plasmodium falciparum, the deadliest causative agent of malaria, has high prevalence in Nigeria. Drug resistance causing failure of previously effective drugs has compromised anti-malarial treatment. On this basis, there is need for a proactive surveillance for resistance markers to the currently recommended artemisinin-based combination therapy (ACT), for early detection of resistance before it become widespread. METHODS: This study assessed anti-malarial resistance genes polymorphism in patients with uncomplicated P. falciparum malaria in Lagos, Nigeria. Sanger and Next Generation Sequencing (NGS) methods were used to screen for mutations in thirty-seven malaria positive blood samples targeting the P. falciparum chloroquine-resistance transporter (Pfcrt), P. falciparum multidrug-resistance 1 (Pfmdr1), and P. falciparum kelch 13 (Pfk13) genes, which have been previously associated with anti-malarial resistance. RESULTS: Expectedly, the NGS method was more proficient, detecting six Pfmdr1, seven Pfcrt and three Pfk13 mutations in the studied clinical isolates from Nigeria, a malaria endemic area. These mutations included rare Pfmdr1 mutations, N504K, N649D, F938Y and S967N, which were previously unreported. In addition, there was moderate prevalence of the K76T mutation (34.6%) associated with chloroquine and amodiaquine resistance, and high prevalence of the N86 wild type allele (92.3%) associated with lumefantrine resistance. CONCLUSION: Widespread circulation of mutations associated with resistance to current anti-malarial drugs could potentially limit effective malaria therapy in endemic populations.","Rare mutations in Pfmdr1 gene of Plasmodium falciparum detected in clinical isolates from patients treated with anti-malarial drug in Nigeria.","18","319","Idowu AO and Oyibo WA and Bhattacharyya S and Khubbar M and Mendie UE and Bumah VV and Black C and Igietseme J and Azenabor AA"
"170","Aaron_2","NO","African health sciences","BACKGROUND: Genes for thalassaemia, haemoglobin S, Glucose-6-phosphate dehydrogenase which confer resistance to malaria are found in high frequencies in Nigeria, 25% of the population being carriers of the sickle cell trait while another 25% are hemizygous for the G6PD gene. The frequency of alpha thalassaemia is equally high among Nigerians but there is little information on beta thalassaemia in this population. A recent study however suggest a high prevalence of beta thalassaemia in the same population, hence the need for this study. METHODS: Haemoglobin A(2) and HbF were determined in healthy adults who have haemoglobin A genotype by elution after electrophoresis and alkaline denaturation methods respectively. RESULTS: The mean HbA(2) among the subjects was 3.3% (range 2.0-5.6%) while the mean HbF was 2.6% (range 0.4-8.8%). Twenty-six percent of the subjects had HbA(2) values higher than 3.9% while 86% had HbF values greater than 1%, twenty-four percent had elevated HbA(2) and HbF. The mean HbA(2) value was 2.7% among those with HbF <1%, 3.6% among those with HbF 1-3% and 3.1% among those with HbF >3%. CONCLUSION: These findings confirm that the frequency of beta thalassaemia in western Nigeria is higher than previously thought and that many of the individuals studied may be silent carriers of the beta thalassaemia trait. Its presence may also have been masked by the high prevalence of alpha thalassaemia in the same environment. It is therefore important to consider beta thalassaemia trait as a differential diagnosis in patients who present with haemolytic anaemia in this environment.","Beta thalassaemia trait in western Nigeria.","9","46-8","Kotila TR and Adeyemo AA and Mewoyeka OO and Shokunb WA"
"186","Aaron_2","NO","Veterinary world","BACKGROUND AND AIM: Campylobacter is a zoonotic bacterium that is a major source of foodborne diseases. In humans, most cases of campylobacteriosis are caused by Campylobacter jejuni. Poultry is the main reservoir of Campylobacter for humans, because Campylobacter is part of the normal flora of the digestive tract of poultry. Antimicrobial resistance to several antibiotics in Campylobacter isolated from humans and food animals has increased rapidly. Beta-lactam is an antibiotic with a high prevalence of resistance in Campylobacter. This study aimed to investigate phenotypic and genotypic (bla(OXA-61)) beta-lactam resistance in C. jejuni from broilers in Indonesia. MATERIALS AND METHODS: A total of 100 samples of broiler intestinal contents were obtained from 10 broiler farms in Pasuruan Regency, Indonesia. Campylobacter jejuni was identified using conventional and polymerase chain reaction (PCR)-based methods. Phenotypic detection of beta-lactam resistance was performed using an antimicrobial susceptibility test with antibiotic disks of aztreonam, ampicillin, and amoxicillin-clavulanic acid. Genotypic detection by PCR was performed using the bla(OXA-61) gene, which encodes beta-lactamase. RESULTS: Campylobacter jejuni was identified in 23% of the samples. Phenotypically, 100% (23/23) and 73.9% (17/23) C. jejuni isolates had high resistance to aztreonam and ampicillin, respectively, but all isolates were susceptible to amoxicillin-clavulanic acid. Genotypically, all isolates carried bla(OXA-61), indicated by the presence of a 372-bp PCR product. CONCLUSION: Campylobacter jejuni is highly resistant to beta-lactams and is a serious threat to human health. Resistance to beta-lactams should be monitored because beta-lactamase genes can be transferred between bacteria. Public awareness must also be increased on the importance of using antibiotics rationally in humans and animals.","First report of phenotypic and genotypic (bla(OXA-61)) beta-lactam resistance in Campylobacter jejuni from broilers in Indonesia.","16","2210-2216","Yanestria SM and Effendi MH and Tyasningsih W and Mariyono M and Ugbo EN"
"192","Aaron_2","YES","Infectious diseases of poverty","BACKGROUND: The spleen plays a pivotal role in the rapid clearance of parasitized red blood cells in patients with falciparum malaria after artemisinin treatment. Prolonged parasite clearance can be found in patients who have had a splenectomy, or those with hemoglobin abnormalities and/or reduced immunity, which are all distinguishable from artemisinin resistance. This paper reports on a case of prolonged parasite clearance in a Chinese splenectomized patient with falciparum malaria imported from Nigeria. CASE PRESENTATION: A 35-year-old Chinese male suffered 2 days of febrile illness after returning to Zhumadian city of Henan province from Nigeria on October 1, 2014. The main symptoms were febrile, including the highest axillary temperature of 40 °C, headache, and chills. A peripheral blood smear showed parasitemia (53 913 asexual parasites/μl) of Plasmodium falciparum. The patient had not used any chemoprophylaxis against malaria in Nigeria when he worked there as a construction worker between 2009 and 2014. The patient had three episodes of malaria in Nigeria and had a splenectomy due to a traffic accident 8 years ago from the time he was admitted to hospital. The patient was orally administrated a total of 320 mg/2.56 g dihydroartemisinin-piperaquine for 2 days and intravenously administrated a total of 3 000 mg artesunate for 18 days. The axillary temperature of the patient ranged between 37.0 and 37.7 °C from Day 0 to Day 3, and blood microscopy revealed falciparum malaria parasitemia (26 674 asexual parasites/μl) on Day 3. The patient was afebrile on Day 4, falciparum malaria parasitemia was continuously present and then gradually decreased on the next days, and was negative on Day 21. The patient was cured and left hospital on Day 24 after no plasmodium falciparum was found in the blood on Day 21 to Day 23. No mutation was found in the K13 propeller gene when compared with the PF3D7_1343700 K13 propeller gene reference sequence. CONCLUSIONS: This is the first reported case in China of prolonged parasite clearance in a splenectomized patient with imported falciparum malaria. Artemisinin resistance should be distinguished when prolonged parasite clearance is found in a malaria patient who has had splenectomy.","Prolonged parasite clearance in a Chinese splenectomized patient with falciparum malaria imported from Nigeria.","6","44","Zhang HW and Li SJ and Hu T and Yu YM and Yang CY and Zhou RM and Liu Y and Tang J and Wang JJ and Wang XY and Sun YX and Feng ZC and Xu BL"
"194","Aaron_2","NO","Transboundary and emerging diseases","Sequencing and analysis of three discrete genome regions of African swine fever viruses (ASFV) from archival samples collected in 2007-2011 and active and passive surveillance between 2012 and 2015 in Nigeria were carried out. Analysis was conducted by genotyping of three single-copy African swine fever (ASF) genes. The E183L and B646L genes that encode structural proteins p54 and p72, respectively, were utilized to delineate genotypes before intragenotypic resolution by characterization of the tetrameric amino acid repeat region within the hypervariable central variable region of the B602L gene. The results showed no variation in the p72 and p54 gene regions sequenced. Phylogeny of p72 sequences revealed that all the Nigerian isolates belonged to genotype I, while that of the p54 recovered the Ia genotype. Analysis of B602L gene revealed the differences in the number of tetrameric repeats. Four new variants (Tet-15, Tet-17a, Tet-17b and Tet-48) were recovered, while a fifth variant (Tet-20) was the most widely distributed in the country displacing Tet-36 reported previously in 2003-2006. The viruses responsible for ASF outbreaks in Nigeria are from very closely related but mutated variants of the virus that have been circulating since 1997. A practical implication of the genetic variability of the Nigerian viral isolates in this study is the need for continuous sampling and analysis of circulating viruses, which will provide epidemiological information on the evolution of ASFV in the field versus new incursion for informed strategic control of the disease in the country.","Genetic Characterization of Circulating African Swine Fever Viruses in Nigeria (2007-2015).","64","1598-1609","Luka PD and Achenbach JE and Mwiine FN and Lamien CE and Shamaki D and Unger H and Erume J"
"200","Aaron_2","NO","BMC research notes","OBJECTIVE: Schistosomiasis remains a chronic disease of global importance, especially in many rural areas of the world where co-infection with Plasmodium falciparum is common. It is critical to decipher the role of single or co-infected disease scenarios on immune system regulation in such individuals and how such co-infections can either ameliorate or complicate immune response and the consequent disease outcome. First, 10 ml of urine samples, collected between 10:00 am and 2:00 pm, was filtered for diagnosis of schistosomiasis, while egg count, indicative of disease severity, was determined by microscopy. Furthermore, genomic DNA samples extracted from dried blood spots collected on filter paper from one hundred and forty-four Schistosoma haematobium-infected school-children was tested for P. falciparum parasite positivity by an allele-specific nested-PCR analysis of merozoite surface protein (msp)-1 and -2 genes and a real-time PCR assay. In addition, among P. falciparum parasite-positive individuals, we carried out a Taqman SNP genotyping assay to extrapolate the effect of host CD14 (-159 C/T; rs2569190) genetic variants on schistosome egg count. RESULTS: Of the 144 individuals recruited, P. falciparum parasite positivity with msp-1 gene were 34%, 43% and 55% for MAD20, RO33 and K1 alleles respectively. Of the co-infected individuals, CD14 genetic variants ranged from 18.8% vs 21.5%, 33.3% vs 44.4%, 9.7% vs 11.8% for single versus schistosome co-infection for the wild type (CC), heterozygous (CT) and mutant (TT) variants respectively. Though the mean egg count for co-infected individuals with CD14 wild type (33.7 eggs per 10 ml of urine) and heterozygote variants (37.5 eggs per 10 ml of urine) were lower than that of schistosome infection alone (52.48 and 48.08 eggs/10 ml of urine respectively), it lacked statistical significance (p-value 0.12 and 0.29), possibly reflecting the benefit of the CD14 activation in schistosome plus malaria co-infection and not schistosome infection alone. In addition, the lower mean egg count in co-infected individuals reveal the benefit of downstream Th1 immune response mitigated by CD14 innate activation that is absent in schistosome infection alone.","Severity of Schistosoma haematobium co-infection with malaria in school-children is potentially modulated by host CD14 gene variants.","16","199","Oboh-Imafidon MA and Torbit SM and Jacob S and Schroeter MN and Tucker AR and Ojurongbe O and Thomas BN"
"203","Aaron_2","NO","The Science of the total environment","The inevitable development of resistance has sunk the great success achieved in the discovery of antimicrobial agents and dashed the hope of man in the recovery from infections and illnesses, as diseases and disease agents that were once thought to be controlled by antimicrobials are now re-emerging in new leagues resistance to therapy. A total of 300 PCR confirmed Escherichia coli isolates recovered from different river sources in Osun State, Nigeria were evaluated for their antibiogram profiling by the disc diffusion method and the resistant isolates were further profiled for their genotypic antimicrobial resistance determinants by polymerase chain reaction assays. Among the 20 antimicrobials selected from 10 families, resistance among sulfonamides, β-lactams and tetracyclines were found to be most frequent than phenicols and aminoglycosides with a noticeable increase in the number of multi-drug resistance ranging from three to nine antimicrobials. A total of 19 resistance determinants were assessed with their prevalence and distributions obtained as follows; [sulfonamides sulI (8%), sulII (41%)], [β-lactams; ampC 22%; blaTEM, (21%), and blaZ (18%),], [tetracyclines tetA (24%), tetB (23%), tetC (18%), tetD (78%), tetK (15%), and tetM, (10%)], [phenicols; catI (37%), catII (28%), and cmIA1 (19%)] and [aminoglycosides; aacC2 (8%), aphA1 (80%), aphA2 (80%), aadA (79%) and strA (38%)]. The Pearson chi-square exact test revealed many strong significant associations among ampC, blaTEM, blaZ and tetA genes with some determinants screened. The findings signify high increase in the prevalence of multidrug resistant E. coli isolates and resistance determinants indicating increased public health risks associated with the ingestion of waters from untreated sources. Hence, a necessity for safe water supply, provision of proper sanitation facilities and good surveillance programmes to monitor antimicrobial resistance patterns in water bodies.","Antimicrobial resistance determinants of Escherichia coli isolates recovered from some rivers in Osun State, South-Western Nigeria: Implications for public health.","523","82-94","Titilawo Y and Obi L and Okoh A"
"212","Aaron_2","NO","Frontiers in microbiology","Gastrointestinal illnesses continue to be a global public health risk. Exposure to foodborne Salmonella directly or indirectly through consumption of ready-to-eat seafood can be an important route of infection to humans. This study was designed to estimate the population cell density, prevalence, virulence gene signatures, and antibiotic resistance of Salmonella serovars from ready-to-eat shrimps. Ready-to-eat (RTE) shrimp samples were obtained from different open markets in Delta and Edo States, Nigeria from November 2016 to October 2017. We employed classical and polymerase chain reaction (PCR) approaches. The mean Salmonella species enumerated from the RTE shrimps ranged from -0.301 to 5.434 log(10) cfu/g with 210/1440 (14.58%) of the RTE shrimp samples harbored Salmonella species. After biochemical and PCR approach, the identified isolates were Salmonella Enteritidis 11(24.4%), Salmonella Typhimurium 14 (31.1%) and other Salmonella spp. 20 (44.4%). All Salmonella species recovered were resistant to penicillin and erythromycin with 100% sensitivity to cefotaxime, cephalothin, colistin, and polymyxin B. Findings on the multidrug-resistant (MDR) profile showed that a total of 9/14 (64.3%) of Salmonella Enteritidis were resistant to 5 antibiotics which belongs to 3 different groups of antimicrobials with a multiple antibiotic-resistant (MAR) index of 0.21; while 3/11 (27.3%) of Salmonella Typhimurium were resistant to 11 antibiotics which belongs to 7 different groups of antimicrobials with a MAR index of 0.46. Virulence genes (spiA, sipB, invA, sif A, fljB, and sefA) and resistance genes (class 1 and II integrase, sul2, catB3, flor, tmp, bla (TEM), strB, dfr1, and tetC) were also detected in some of the Salmonella species with variable percentage. This study indicates that ready-to-eat shrimps are probable reservoirs harboring Salmonella strains. The identified Salmonella isolates which exhibited virulence determinants and antibiotic-resistant coupled with high MAR index constitute a consumer health risk to the communities.","Prevalence of Antimicrobial Resistance and Virulence Gene Elements of Salmonella Serovars From Ready-to-Eat (RTE) Shrimps.","10","1613","Beshiru A and Igbinosa IH and Igbinosa EO"
"227","Aaron_2","NO","Environmental pollution (Barking, Essex : 1987)","The extensive use of antibiotics in food animal production and disposal of untreated wastewater from food animal slaughter facilities may create a shift in microbiomes of different ecosystems by generating reservoirs of antimicrobial resistance along the human-animal-environmental interface. This epidemiological problem has been studied, but its magnitude and impact on a global scale is poorly characterised. A systematic review was done to determine global prevalence and distribution patterns of antimicrobial resistance in effluent wastewater from animal slaughter facilities. Extracted data were stratified into rational groups for secondary analyses and presented as percentages. Culture and sensitivity testing was the predominant method; Escherichia spp., Enterococcus spp., and Staphylococcus aureus were the most targeted isolates. Variable incidences of resistance were detected against all major antimicrobial classes including reserved drugs such as ceftazidime, piperacillin, gentamicin, ciprofloxacin, and chloramphenicol; the median frequency and range in resistant Gram-negative isolates were: 11 (0-100), 62 (0-100), 8 (0-100), 14 (0-93) and 12 (0-62) respectively. Ciprofloxacin was the most tested drug with the highest incidences of resistance in livestock slaughterhouses in Iran (93%), Nigeria (50%) and China (20%), and poultry slaughterhouses in Germany (21-81%) and Spain (56%). Spatial global distribution patterns for antimicrobial resistance were associated with previously reported magnitude of antibiotic use in livestock or poultry farming and, the implicit existence of jurisdictional policies to regulate antibiotic use. These data indicate that anthropogenic activities in farming systems are a major contributor to the cause and dissemination of antimicrobial resistance into the environment via slaughterhouse effluents.","Prevalence and distribution of antimicrobial resistance in effluent wastewater from animal slaughter facilities: A systematic review.","318","120848","Foyle L and Burnett M and Creaser A and Hens R and Keough J and Madin L and Price R and Smith H and Stone S and Kinobe RT"
